{
"Record_ID": 1, 
"Record_ID-myngl-security": "",
"Carrier_ID": "alphanumeric", 
"Carrier_ID-myngl-security": "",
"Carrier_Name": "alphanumeric", 
"Carrier_Name-myngl-security": "",
"Carrier_Address": "alphanumeric", 
"Carrier_Address-myngl-security": "",
"Carrier_Address": "alphanumeric", 
"Carrier_Address-myngl-security": "",
"Carrier_City": "alphanumeric",
"Carrier_City-myngl-security": "",
"Carrier_Zip": 1, 
"Carrier_Zip-myngl-security": "",
"Carrier_State": "alpha", 
"Carrier_State-myngl-security": "",
"Customer_First_Name": "alpha", 
"Customer_First_Name-myngl-security": "",
"Customer_Middle_Init": "alpha", 
"Customer_Middle_Init-myngl-security": "",
"Customer_Last_Name": "alpha", 
"Customer_Last_Name-myngl-security": "",
"Customer_SSN": 1, 
"Customer_SSN-myngl-security": "",
"Customer_Name": 1, 
"Customer_Name-myngl-security": "",
"Customer_Address": "alphanumeric", 
"Customer_Address-myngl-security": "",
"Customer_Address": "alphanumeric", 
"Customer_Address-myngl-security": "",
"Customer_City": "alphanumeric", 
"Customer_City-myngl-security": "",
"Customer_Zip": 1, 
"Customer_Zip-myngl-security": "",
"Customer_State": "alpha", 
"Customer_State-myngl-security": "",
"Customer_Phone": "xxx-xxx-xxxx",
"Customer_Phone-myngl-security": "",
"Customer_Email": "email", 
"Customer_Email-myngl-security": "",
"Invoice_Amount": "currency", 
"Invoice_Amount-myngl-security": "",
"Invoice_Date": "date", 
"Invoice_Date-myngl-security": "",
"Payment_Due_Date": "date", 
"Payment_Due_Date-myngl-security": "",
"Payment_Received": "alpha", 
"Payment_Received-myngl-security": "",
"Payment_Received_Date": 1,
"Payment_Received_Date-myngl-security": "",
"Balance_Due": "currency", 
"Balance_Due-myngl-security": ""
}

